{
  "task_id": "auth-refactor-01",
  "status": "completed",
  "summary": "Login handler now delegates to the session service. Two tests were updated to inject the service; all twelve pass.",
  "files_changed": [
    {
      "path": "src/auth/login.py",
      "action": "modified"
    },
    {
      "path": "tests/test_auth.py",
      "action": "modified"
    }
  ],
  "verification_run": [
    {
      "command": "python -m pytest tests/test_auth.py",
      "exit_code": 0,
      "output_summary": "12 passed in 1.8s"
    }
  ],
  "findings": [],
  "risks": [
    "Session cache TTL now affects login freshness; parent should review config default"
  ],
  "deferred": [],
  "next_action": "Parent: diff worktree vs owned_paths, then merge the phase summary into memory-bank/activeContext.md.",
  "tokens_used": 1850
}
